{
  "assignment_permutations": [
    {
      "ordered_field_ids": [
        "A",
        "B"
      ],
      "permutation_id": "AB"
    },
    {
      "ordered_field_ids": [
        "B",
        "A"
      ],
      "permutation_id": "BA"
    }
  ],
  "binary_grayscale_status": {
    "complement_fields": "binary-grayscale-8",
    "partition_fields": "binary-grayscale-8",
    "preview": "illustrative-grayscale-8"
  },
  "compatible_workflows": [
    {
      "classification": "illustrative",
      "execution_status": "asset-inspection-only",
      "filename": "workflows/two-layer.top-bottom.v1.asset-inspection.workflow.json",
      "sha256": "6d4871009f622f18e154eadd0c83d2901215b5a7bde82989ed4cbf55767aab27",
      "workflow_id": "two-layer.top-bottom.v1.asset-inspection"
    }
  ],
  "description": "Exact hard partition at the horizontal center line.",
  "display_name": "Top / Bottom",
  "fields": [
    {
      "asset_id": "A",
      "filename": "two-layer/top-bottom/field-a.png",
      "role": "partition-field",
      "sha256": "46df102a4ee7d6930939abe9b941a28d6ca0c7af98d459add41f5a2fce361782"
    },
    {
      "asset_id": "B",
      "filename": "two-layer/top-bottom/field-b.png",
      "role": "partition-field",
      "sha256": "df1c134076cffcfc2359d5d355a61f4dd18d3739afaf8a5e045343e3cce79ed5"
    }
  ],
  "generator": {
    "generator_id": "conditioning-layers.influence-field-library.generator",
    "generator_version": 1,
    "parameters": {
      "kind": "horizontal_split",
      "split_y": 64
    },
    "source_sha256": "3cbd830c313e94f9ff8a37daac9fdbffbf0dfaec255b169c546cdf170c9fdadc"
  },
  "geometric_variants": [
    {
      "operation": "mirror-vertical",
      "source_to_target_field_mapping": {
        "A": "B",
        "B": "A"
      },
      "target_pattern_family_id": "two-layer.top-bottom.v1",
      "variant_id": "mirror-vertical"
    },
    {
      "operation": "rotate-90-counterclockwise",
      "source_to_target_field_mapping": {
        "A": "A",
        "B": "B"
      },
      "target_pattern_family_id": "two-layer.left-right.v1",
      "variant_id": "rotate-90-counterclockwise"
    }
  ],
  "image_mode": "grayscale-8",
  "intended_use": [
    "research control",
    "two-layer spatial assignment"
  ],
  "known_limitations": [
    "P1A validates the exact partition assets through offline product staging, not rendered image quality.",
    "A hard center boundary can produce seams or topology changes."
  ],
  "layer_count": 2,
  "library_version": 1,
  "partition_relationship": {
    "complete_coverage": true,
    "equation": "A + B = 255",
    "overlap_pixel_count": 0,
    "per_pixel_sum": 255,
    "unassigned_pixel_count": 0
  },
  "pattern_family_id": "two-layer.top-bottom.v1",
  "pixel_complements": [
    {
      "asset_id": "not-A",
      "equivalent_partition_sum": [
        "B"
      ],
      "expression": "255 - A",
      "filename": "two-layer/top-bottom/not-a.png",
      "role": "pixel-complement",
      "sha256": "df1c134076cffcfc2359d5d355a61f4dd18d3739afaf8a5e045343e3cce79ed5",
      "source_field_id": "A"
    },
    {
      "asset_id": "not-B",
      "equivalent_partition_sum": [
        "A"
      ],
      "expression": "255 - B",
      "filename": "two-layer/top-bottom/not-b.png",
      "role": "pixel-complement",
      "sha256": "46df102a4ee7d6930939abe9b941a28d6ca0c7af98d459add41f5a2fce361782",
      "source_field_id": "B"
    }
  ],
  "preview": {
    "asset_id": "two-layer.top-bottom.v1.preview",
    "filename": "previews/two-layer.top-bottom.v1.png",
    "role": "composite-preview",
    "sha256": "18a83dc3a57bd3e3fbd9ff36a1064b925b00bb0d896caa58393b1351aecd3ac1"
  },
  "resolution": {
    "height": 128,
    "width": 128
  },
  "schema_id": "conditioning-layers.influence-field-family-manifest",
  "schema_version": 1,
  "support_status": "validated-product-asset"
}
